[
  {
    "endpoint": "/api/v1/items/",
    "method": "POST",
    "change_type": "field_type_changed",
    "breaking": true,
    "old_schema_fragment": {
      "description": "string"
    },
    "new_schema_fragment": {
      "description": "array"
    },
    "severity": "high",
    "detected_at": "2026-09-26T17:00:00.789863+00:00"
  },
  {
    "endpoint": "/api/v1/items/{id}",
    "method": "GET",
    "change_type": "field_type_changed",
    "breaking": true,
    "old_schema_fragment": {
      "description": "string"
    },
    "new_schema_fragment": {
      "description": "array"
    },
    "severity": "high",
    "detected_at": "2026-09-26T17:00:00.789863+00:00"
  },
  {
    "endpoint": "/api/v1/items/{id}",
    "method": "PUT",
    "change_type": "field_type_changed",
    "breaking": true,
    "old_schema_fragment": {
      "description": "string"
    },
    "new_schema_fragment": {
      "description": "array"
    },
    "severity": "high",
    "detected_at": "2026-09-26T17:00:00.789863+00:00"
  }
]